DateStamp,TimeStamp,Name,Category,Price,Description,SoldOut
2022-11-21,17:55:34,_prodDefaultCategory0,"23"" LED Color Changing Umbrella with Flashlight","Color, Changing, Umbrella, with, Flashlight&nbsp;, Solid, black, fabric, with, reflective, strip, Lifetime, of, lighting:, 5,000, hours&nbsp;, Requires, 3, AAA, batteries,, included&nbsp;, 23&quot;L",6.99,False
2022-11-21,17:55:34,_prodDefaultCategory0,"23"" Stacked Granite Fountain","Fountain, Pump,, LED, light,, and, basin, included&nbsp;, Color, :, Beige, Overall, dimensions, :, 23&quot;H, x, 14&quot;W, Weight, :, 57, lbs",299.99,False
2022-11-21,17:55:34,camping,24 Lumen LED Mini Camping Lantern,"lantern, 24, Lumens, LED, Dimmer, switch, 360&deg;, Illumination, Easy, grip, rubber, construction&nbsp;, Fold, away, carry, handle, ABS, body, and, reflector, Requires, three, AA, batteries,, included&nbsp;, Available, in, assorted, colors., Selection, varies, by, store.",4.99,False
2022-11-21,17:55:34,storm-preparation,"24"" Bungee Cords, 2-Count","9MM&nbsp;, Made, from, 10%, Virgin, Rubber, Polypropylene, fabric, covering, Color:, Blue, Dimensions, (each, cord):, 24&quot;, L, 2-count",1.99,False
2022-11-21,17:55:34,_prodDefaultCategory0,"24"" Deck Rail Resin Planter in Green","Rail, Resin, Planter, in, Green, 24&quot;L&nbsp;",12.99,False
2022-11-21,17:55:34,10-and-under-spring-and-summer-deals,"24"" Plastic Leaf Rake with Foam Grip Handle","leaf, rake, Foam, grip, handle",9.0,False
2022-11-21,17:55:34,_prodDefaultCategory0,"24"" Single Stem Plant Support","Stem, Plant, Support&nbsp;, 4.8MM, vinyl, coated, wire&nbsp;, Color:, Green, 2.25&quot;, loop, 24&quot;H",1.5,False
2022-11-21,17:55:34,autumn-essentials,"24"" Steel Tine Leaf Rake with Foam Grip Handle","tine, leaf, rake, Foam, grip, handle",14.0,False
2022-11-21,17:55:34,garden-tools-and-equipment,"24"" Universal Railing Planter","Railing, Planter, Designed, to, fit, two, railing, sizes:, 2&quot;x4&quot;, and, 2&quot;x6&quot;, Easy, to, remove, drain, plugs",12.99,False
2022-11-21,17:55:34,_prodDefaultCategory0,"24"" Window Box with Attached Saucer","Box, with, Attached, Saucer&nbsp;, Color:, Terracota, 24&quot;W&nbsp;",9.0,False
2022-11-21,17:55:34,_prodDefaultCategory0,"24"" x 60"" Multi-Purpose Washable Runner","runner, Great, for, dorms,, entryways,, kitchens,, laundry, rooms, and, more, Non-slip, latex, backing, Machine, washable, Stain-resistant, Low, profile, 100%, Polypropylene, Made, in, Egypt, Available, in, assorted, colors., Selection, varies, by, store., 24&quot;, W, x, 60&quot;, L",8.99,False
2022-11-21,17:55:34,Test-Collection,"24""x24"" Puppy Pads with Odor Eliminators, 50-Count","w/Odor, eliminators, Tear-resistant, Soft, quilted, surface, absorbs, moisture, &amp;, controls, odors, Protects, floor, with, leak-resistant, bottom, Attracts, puppies, Eliminates, odors, Protects, floors, 24&quot;, W, X, 24&quot;, L, 50-count",12.99,False
2022-11-21,17:55:34,pet-supplies,"24""x24"" Puppy Pads with Odor Eliminators, 50-Count","with, Odor, Eliminators, Attracts, puppies, Eliminates, odors, Protects, floors, Tear-resistant, Soft, quilted, surface, Protects, floors, with, leak-resistant, bottom, 50-count, Overall, dimensions, :, 24&quot;, W, x, 24&quot;, L",12.99,False
2022-11-21,17:55:34,_prodDefaultCategory0,"24""x36"" Printed Coir Doormat with Vinyl Backing","Doormat, with, vinyl, backing, All-natural, coconut, fibers&nbsp;, 100%, Eco-friendly&nbsp;, Anti-slip, vinyl, backing, Traps, dirt,, debris,, and, moisture, Available, in, assorted, designs., Selection, varies, by, store., 24&quot;, W, x, 36&quot;, L",14.0,False
2022-11-21,17:55:34,boot-trays-and-door-mats,"24""x39"" Rubber Scroll Doormat","doormat, Non-slip&nbsp;, Moisture, absorbing, 24&quot;, W, x, 39&quot;, L",12.0,False
2022-11-21,17:55:34,doormats,"24""x48"" Multi-Purpose Washable Accent Rug","rug, Great, for, dorms,, entryways,, kitchens,, laundry, rooms,, and, more, Non-slip, latex, backing, Machine, washable, Stain-resistant, Low, profile, 100%, Polypropylene, Made, in, Egypt, Available, in, assorted, colors., Selection, may, vary, by, store., 24&quot;, W, x, 48&quot;, L",8.99,False
2022-11-21,17:55:34,electrical,25' 12/3 Heavy-Duty Outdoor Extension Cord with Lighted Ends,"extension, cord, with, lighted, ends, Oil, and, water-resistant, Ultra, flexible, Medium, duty, 12/3, Gauge, 25&#39;, L",24.99,False
2022-11-21,17:55:34,autumn-essentials,25' x 45' All-Purpose Weather Resistant Tarp,"polyethylene, Polypropylene, rope, around, hem, Rustproof, grommets, Easy, to, clean, Tear-resistant, Superior, all-weather, protection, Cut, size:, 25&#39;, W, x, 45&#39;, L",76.99,False
2022-11-21,17:55:34,_prodDefaultCategory0,"26"" x 60"" Ribbed Runner with Skid-Resistant Backing","Ribbed, construction, traps, dirt, and, moisture, in, recessed, channels, Durable,, stain, and, fade, resistant, needle, punch, carpet-top, Skid-resistant, latex, gel, backing, Low-profile, design, won&#39;t, get, in, the, way, of, doors&nbsp;, Polyester, face,, latex, gel, backing, Available, in, assorted, colors., Selection, varies, by, store., 26&quot;W, &nbsp;x, 60&quot;L",10.0,False
2022-11-21,17:55:34,_prodDefaultCategory0,"26"" x 69' Diamond Indoor Carpet Runner","Carpet, Runner, Sisal, style, woven&nbsp;surface, is, ideal, for, high-traffic, areas,, including, staircases&nbsp;, Anti-skid, gel, foam, backing, Polyolefin, fibers, are, stain, resistant&nbsp;, Color, :, Black, with, diamond, design, Overall, dimensions, :, 26&quot;W, x, 69&#39;L&nbsp;",199.99,False
2022-11-21,17:55:34,10-and-under-spring-and-summer-deals,"27"" Flip-Flop Wind Chime","chime, Use, indoor, or, outdoor, Available, in, assorted, styles.&nbsp;, Selection, varies, by, store., 27&quot;, L",9.99,False
2022-11-21,17:55:34,_prodDefaultCategory0,"27""x45"" Indoor and Outdoor Buffalo Check Rug","outdoor, Buffalo, Check, rug, Ultra-durable, rug, made, of, PET, polyester, to, withstand, the, elements, and, resist, stains,, spills,, mold,, and, mildew., They, are, as, versatile, as, they, are, beautiful., Anti-slip, back, Indoor, and&nbsp;outdoor, use, 100%, PET, polyester, Nonskid&nbsp;latex, backing, Made, in, India, Available, in, assorted, colors.&nbsp;, Selection, varies, by, store., 27&quot;, W, x, 45&quot;, L",12.99,False
2022-11-21,17:55:34,firepits,"29"" Deep Round Fire Pit with Dome Shaped Screen Protector","fire, pit&nbsp;, Includes, dome-shaped, screen, protector,, crossbar, grid,, and, fire, tool, High-temperature, paint, finish&nbsp;, Lattice, pattern, design, Steel, leg, base, construction&nbsp;, Dimensions:, 34.75, in, diameter, x, 29&quot;, D, x, 27&quot;, H",79.99,False
2022-11-21,17:55:34,_prodDefaultCategory0,"29"" x 46"" Heavy Duty Rubber Doormat","Rubber, Doormat&nbsp;, Woven, carpet, design, fits, any, decor, Traps, dirt, and, water, Durable, recycled, rubber, backing, Use, indoors, or, outdoors, 29&quot;, W&nbsp;x, 46&quot;, L, Color:, Pewter",14.99,False
2022-11-21,17:55:34,_prodDefaultCategory0,2Boom Bluetooth Portable Twister Wireless Speaker,"wireless, speaker, with&nbsp;, microphone, Deep, Digital, Bass, Colorful, Light, FX, FM, Radio, SD, card, slot, USB, slot",19.99,False
2022-11-21,17:55:34,electronics,2BOOM Boom Go Portable Bluetooth Speaker,"USB, charger, and, built-in, battery, Link, devices, via, AUX, cable, Built, in, Micro, Deep, bass, Hands, free, talking, Rubber, exterior, Bluetooth, 4.0, Working, range:, 10, yds, Playing, time:, 1, -, 2, Hours&nbsp;, Available, in&nbsp;, Black,, Red,, White,, Blue,, and, Rose, Gold., Assortment, may, vary, by, store.&nbsp;, 8.5&quot;L, x, 2.25&quot;W, x, 2.75&quot;H&nbsp;",9.99,False
2022-11-21,17:55:34,cell-phone-accessories,2BOOM Over Ear Wired Stereo Headphones with Mic,"offers, maximum, comfort,, while, the, noise, isolation, allows, you, to, block, out, any, distractions, The, full, range, drivers, provide, deep,, enhanced, lows,, while, retaining, clean, mids, and, crisp, highs, Take, calls, on, the, go,, at, your, desk, or, in, the, studio, with, the, hands, free, inline, microphone, 1.5M, cable, Available, in, Black,, White,, Blue,, Red, and, Purple., Assortment, may, vary, by, store.",5.99,False
2022-11-21,17:55:34,_prodDefaultCategory0,2Boom Roam Air True Wireless Bluetooth Earphones,"Earphones, Built-in, microphone, Includes, Charging, Case",9.99,False
2022-11-21,17:55:34,furniture,"3 Cube Bookcase, White","bookcase, Color:, white, 12&quot;, W, x, 11&quot;, D, x, 35&quot;, H",24.99,False
2022-11-21,17:55:34,10-and-under-spring-and-summer-deals,3 Gallon Planter Bag,"allows, roots, to, breathe, Boosts, plant, growth, and, yields, Fabric, pots, offer, better, drainage, 11&quot;&nbsp;x, 10&quot;&nbsp;",4.99,False
2022-11-21,17:55:34,cell-phone-accessories,"3 in 1 USB Charge and Sync Cable, 10 ft","1, USB, Charge, and, Sync, 10, ft",6.99,False
2022-11-21,17:55:34,cell-phone-accessories,"3 in 1 USB Charge and Sync, 3 ft","1, USB, Charge, and, Sync, Micro, USB, Apple, Type, C, 3, ft",4.99,False
2022-11-21,17:55:34,electrical,3 Outlet Household Extension Cord,"3-Outlet, household, extension, cord, Turns, one, outlet, into, three, Features, child, safety, outlet, cover",3.29,False
2022-11-21,17:55:34,BTS-School-and-Office-Supplies,"3 Subject College Ruled Spiral Notebook, 120 Sheets","College, ruled&nbsp;, 3, Subject, Available, in, assorted, colors., Selection, varies, by, store.&nbsp;, Dimensions:, 8&quot;, W, x, 10.5&quot;, L, 120, sheets",1.5,False
2022-11-21,17:55:34,BTS-School-and-Office-Supplies,"3 Subject Wide Ruled Spiral Notebook, 120 Sheets","Wide, ruled, Available, in, assorted, colors., Selection, varies, by, store.&nbsp;, Dimensions:, 8&quot;, W, x, 10.5&quot;, L, 120, sheets&nbsp;",1.5,False
2022-11-21,17:55:34,storage,"3 Tier Large Wire Rolling Cart, 33""","Large, Wire, Rolling, Cart, Durable, polyethylene, finish, will, not, chip, or, rust, Heavy, gauge, welded, steel, construction, Durable, nylon, wheels, Patented, assembly, (no, tools, required), Made, in, Italy, Color, :, white, Dimensions, :, 25&quot;, W, x, 12.2&quot;, D, x, 33&quot;, H",29.99,False
2022-11-21,17:55:34,storage,"3 Tier Rolling Wire Cart, 16.25""W x  9""D x 25""H","Rolling, Wire, Cart, Small, 16.25&quot;W&nbsp;x&nbsp;, 9&quot;D&nbsp;x, 25&quot;H, White",16.99,False
2022-11-21,17:55:34,_prodDefaultCategory0,"3 Tier Slim Wire Rolling Rack, 33""","Slim, Wire, Rolling, Rack, Durable, polyethylene, finish, will, not, chip, or, rust, Heavy-gauge, welded, steel, construction, Durable, nylon, wheels, Made, in, Italy, Assembled, dimensions:, 22&quot;, W, x, 9&quot;, D, x, 33&quot;, H",21.99,False
2022-11-21,17:55:34,10-and-under-spring-and-summer-deals,"3"" Biodegradable Seed Starting Jiffy-PotsÂ®, 22-pots","starting, pots, Perfect, for, vegetables,, herbs,, and, flowers, Natural, &amp;, organic, peat, OMRI, listed, Easy, 3-step, process, Zero, root, shock,, roots, grow, through, pot, 22-peat, pots, 3&quot;, in, diameter, x, 3&quot;, H",4.0,False
2022-11-21,17:55:34,_prodDefaultCategory0,"3"" Reflectors, 2-Count","Break-resistant, Easy, to, mount, Acrylic, construction, Self-adhesive, backing, 2-count",2.99,False
2022-11-21,17:55:34,autumn-essentials,"3"" Self-Adhesive Reflectors, 2-Pack","Reflectors, Break-resistant, Easy, to, mount, Acrylic, construction, Self-adhesive, backing, Color:, Red&nbsp;, 2-pack",2.99,False
2022-11-21,17:55:34,electrical,3' 6 Outlet Power Strip,"6, Outlet, power, strip&nbsp;, UL, Listed, Color:, White&nbsp;",4.49,False
2022-11-21,17:55:34,christmas-trees-and-trim,"3' Artificial Christmas Tree, 91 Branch Tips","tree, 91, Branch, tips,, 5.5&quot;-10&quot;L&nbsp;, Tree, stand, included, with, three, legs, 12.7MM, Pole, diameter, 3&#39;H",6.99,False
2022-11-21,17:55:34,10-and-under-spring-and-summer-deals,"3' Bamboo Plant Stakes, 20 Pack","stakes, Ideal, for, annuals, perennials, vegetables, small, shrubs, and, climbing, plants, 20, pack",3.0,False
2022-11-21,17:55:34,lawn-and-garden,3' Metal Plant Stake,"stake, Green, vinyl-coated, steel, 3&#39;, L",1.25,False
2022-11-21,17:55:34,autumn-essentials,3' x 4' Scraper Entrance Mat,"traps, dirt, and, moisture, in, recessed, channels, Durable,stain, and, fade, resistant, needlepunch, carpet-top, Non-skid, backing, Low-profile, design, won&#39;t, get, in, the, way, of, doors&nbsp;, Available, in, assorted, colors., Assortment, may, vary, by, store., 3&#39;W, x, 4&#39;L",10.0,False
2022-11-21,17:55:34,_prodDefaultCategory0,3' x 50' Weed Control Fabric,"fabric, Helps, suppress, weeds, around, flower, beds,, trees, and, shrubs, Fabric, allows, air, and, water, to, pass, through, for, healthy, soil, Cover, with, mulch,, bark, or, stone, for, an, attractive, finish, 3&#39;W, x, 50&#39;L",12.0,False
2022-11-21,17:55:34,art-supplies,3-4 Yard Upholstery Fabric,"Available, in, assorted, colors, and, paterns.&nbsp;, Selection, varies, by, store., 3-4, yds",6.0,False
2022-11-21,17:55:34,hardware,3-Arm Multi-Directional LED Light,"multi-directional, LED, light, Adjustable, light, panels, fold, 90&deg;, Compatible, with, E27, regular, light, socket, 15W, per, panel, /, 45W, total, 50,000, hour, LED, 6,000, Lumens",14.99,False
2022-11-21,17:55:34,boss-back-to-campus,"3-Drawer Storage Tower, Gray","Tower,, Gray, Mfg, #:&nbsp;STO08796, 3, easy-glide, drawers, offer, hideaway, space, for, items, to, de-clutter, your, room, 19, in, x, 12.5, in, top, surface, perfect, for, a, lamp,, books,, or, a, picture, frame, Fabric:, polyester, and, non-woven,, frame:, steel, +, wood, accents, Overall, dimensions, :, 19&quot;W, x, 32&quot;H, x, 12.5&quot;D, Box, dimensions, :, 27.95&quot;L, x, 18.31&quot;W, x, 4.92&quot;H",79.99,False
2022-11-21,17:55:34,buy-online,"3-Person Outdoor Swing, Beige","Swing,, Beige, Mfg, #:&nbsp;HJ-SW-017, Adjustable, roof, canopy, Steel, frame, Includes, cushions, Store, during, winter, 3-seater&nbsp;, Jacquard, fabric, Overall, dimensions, :, 48&quot;L, x, 80&quot;W, x, 66&quot;H&nbsp;, Box, dimensions, :, 76&quot;L, x, 12&quot;W, x, 12&quot;H",499.99,False
2022-11-21,17:55:34,buy-online,"3-Piece Cast Aluminum Outdoor Bistro Set with Leaf Design, White","Aluminum, Outdoor, Bistro, Set, with, Leaf&nbsp;Design,, White, Mfg, #:&nbsp;YHFHW020-W, Cast, aluminum, and, cast, iron, frame, Leaf, design, Weather-resistant,, powder-coated, finish, Features, 2, chairs, and, a, small, round, bistro, table, with, an, umbrella, hole, This, compact, set, is, the, perfect, addition, to, any, patio,, balcony,, or, small, porch, Color, :, White, Weight, capacity, :, 200, lbs, per, chair, Overall, dimensions, :&nbsp;, Chair:, 33.23&quot;H, x, 18&quot;L, Table:, 26.57&quot;H, x, 23.62&quot;, dia., Umbrella, hole:, 1.8&quot;, dia.",199.99,False
2022-11-21,17:55:34,buy-online,"3-Piece Cast Aluminum Outdoor Bistro Set with Rose Design, Black","Aluminum, Outdoor, Bistro, Set, with, Rose, Design,, Black, Mfg, #:&nbsp;YHFHW019-B, Cast, aluminum, and, cast, iron, frame, Rose, design, Weather-resistant,, powder-coated, finish, Features, 2, chairs, and, a, small, round, bistro, table, with, an, umbrella, hole, This, compact, set, is, the, perfect, addition, to, any, patio,, balcony,, or, small, porch, Color, :, Black, Weight, capacity, :, 200, lbs, per, chair, Overall, dimensions, :&nbsp;, Chair:, 33.23&quot;H, x, 18&quot;L, Table:, 26.57&quot;H, x, 23.62&quot;, dia., Umbrella, hole:, 1.8&quot;, dia.",199.99,False
2022-11-21,17:55:34,buy-online,"3-Piece Cast Aluminum Outdoor Bistro Set with Rose Design, White","Aluminum, Outdoor, Bistro, Set, with, Rose, Design,, White, Mfg, #:&nbsp;YHFHW019-W, Cast, aluminum, and, cast, iron, frame, Rose, design, Weather-resistant,, powder-coated, finish, Features, 2, chairs, and, a, small, round, bistro, table, with, an, umbrella, hole, This, compact, set, is, the, perfect, addition, to, any, patio,, balcony,, or, small, porch, Color, :, White, Weight, capacity, :, 200, lbs, per, chair, Overall, dimensions, :&nbsp;, Chair:, 33.23&quot;H, x, 18&quot;L, Table:, 26.57&quot;H, x, 23.62&quot;, dia., Umbrella, hole:, 1.8&quot;, dia.",199.99,False
2022-11-21,17:55:34,buy-online,"3-Piece Cast Aluminum Outdoor Bistro Set with Tulip Design, Black","Aluminum&nbsp;Outdoor, Bistro, Set, with, Tulip, Design,, Black, Mfg, #:&nbsp;YHFHW001-B, Cast, aluminum, and, cast, iron, frame, Tulip, design, Weather, resistant, powder, coated, finish, Featuring, 2, chairs, and, a, small, round, bistro, table, with, an, umbrella, hole, With, its, small, footprint,, this, compact, set, is, the, perfect, addition, to, any, patio,, balcony,, or, small, porch, Assembly, required, Color, :, Black, Weight, capacity, (per, chair):, 200, lbs, Overall, dimensions, :, Chair:, 33.2&quot;H, x, 14.6&quot;D&nbsp;, Table:, 23.6&quot;W, x, 25.4&quot;H, Box, dimensions, :, 25.98&quot;L, x, 25.98&quot;W, x, 5.91&quot;H",199.99,False
2022-11-21,17:55:34,buy-online,"3-Piece Cast Aluminum Outdoor Bistro Set with Tulip Design, White","Aluminum, Outdoor, Bistro, Set, with, Tulip&nbsp;Design,, White, Mfg, #:&nbsp;HFHW001-W2, Features, 2, small, chairs, and, a, small, round, bistro, table, with, an, umbrella, hole, This, compact, set, is, the, perfect, addition, to, any, patio,, balcony,, or, small, porch, Cast, aluminum, and, cast, iron, frame, Tulip, design, Adjustable, foot, pads, Weather-resistant, and, powder-coated, finish, Color, :, White, Weight, capacity, (per, chair):, 200, lbs, Overall, dimensions, :, Table, dimensions:, 24&quot;, dia.&nbsp;x, 25.3&quot;H, Chair, dimensions:, 16&quot;L&nbsp;x, 16&quot;W, x, 33.3&quot;H, Umbrella, hole:, 1.8&quot;",199.99,False
2022-11-21,17:55:34,buy-online,"3-Piece Cast Aluminum Outdoor Bistro Set with Rose Design, Bronze","Aluminum, Outdoor, Bistro, Set, with&nbsp;Rose, Design,, Bronze, Mfg, #:&nbsp;YHFHW017-B, Features, 2, small, chairs, and, a, small, round, bistro, table, with, an, umbrella, hole, This, compact, set, is, the, perfect, addition, to, any, patio,, balcony,, or, small, porch, Cast, aluminum, and, cast, iron, frame, Rose, design, Adjustable, foot, pads, Weather-resistant, and, powder-coated, finish, Color, :, Bronze, Weight, capacity, (per, chair):, 200, lbs, Overall, dimensions, :, Table, dimensions:, 24&quot;, dia.&nbsp;x, 25.3&quot;H, Chair, dimensions:, 16&quot;L&nbsp;x, 16&quot;W, x, 33.3&quot;H, Umbrella, hole:, 1.8&quot;",199.99,False
2022-11-21,17:55:34,buy-online,"3-Piece High Bar Set, Dark Blue","Bar, Set,, Dark, Blue&nbsp;, The, 3, pieces, contained, within, this, set, are, composed, of&nbsp;, resin, rattan,, making, for, a, modern, and, fashionable, look, Resin, rattan, material, is, relatively, lightweight,, so, this, bar, set, can, easily, be, moved, to, your, choice, of, setting, Patio, set, cushions, are, soft,, and, backrest, provides, comfortable, support, Powder-coated, steel, frame, of, bar, seats, are, rust-resistant,, and, hand-knitted, weather-resistant, ultraviolet, nylon, will, not, fade, Breathable, polyester, waterproof, fabric, is, cool, to, touch, and, ensures, an, enjoyable, outdoor, experience, for, all, four, seasons, Bar, table, is, made, of, tempered, glass, Easy, to, clean&nbsp;, Comes, in, 2, boxes, Overall, dimensions, :&nbsp;, Table, dimensions:, 27.5&quot;W, x, 38.5&quot;H, x, 17&quot;D, Chair, dimensions:, 23&quot;W, x, 40&quot;H, x, 20&quot;D, Box, 1, dimensions, :, 28.35&quot;L, x, 2&quot;H, x, 28.35&quot;W, Box, 2, dimensions, :, 45.67&quot;L, x, 9.84&quot;H, x, 21.65&quot;W",279.99,False
2022-11-21,17:55:34,buy-online,"3-Piece Patio Chaise Lounge Set, Blue","Chaise, Lounge, Set,, Blue, Mfg, #:&nbsp;A8985RYB22, Our, pool, chaise, lounge, chair, set, is, made, with, a, powder-coated, steel, frame., The, back, and, seat, are, made, of, breathable, and, quick-drying, fabric, Textilene, material., Materials, are, durable, and, easy, to, maintain, to, ensure, long-lasting, use, The, backrest, of, this, patio, chaise, lounge, is, slightly, curved, to, provide, better, support, for, the, body.&nbsp;, With, its, 5-position, adjustable, back,, you&#39;re, able, to, change, the, chaise, lounge, into, whichever, position, you&#39;d, like., Moreover,, smooth, armrests, provide, reliable, support,, which, gives, you, more, opportunity, to, enjoy, leisure, time, with, your, friends, and, family., The, back, and, seat, fabric, are, made, of, UV-resistant,, breathable,, Textilene, fabric, for, long-lasting, use., Water, and, oil-proof,, quick-drying,, and, easy, maintenance, Package, includes, all, the, tools, and, hardware, needed, for, assembly, Color:, Blue, Comes, in, two, boxes, Overall, dimensions, :, Chair, dimensions:, 22&quot;W, x, 62&quot;D, x, 39&quot;H, Fully, reclined:, 22&quot;W, x, 75.7&quot;D, Table, dimensions:, 17.8&quot;W, x, 17.8&quot;D, x, 19&quot;H, Box, 1, dimensions, :, 33.46&quot;L, x, 7.28&quot;W, x, 25.2&quot;H, Box, 2, dimensions, :&nbsp;33.46&quot;L, x, 7.28&quot;W, x, 25.2&quot;H, Total, box, weight, :, 78, lbs&nbsp;",279.99,False
2022-11-21,17:55:34,buy-online,"3-Piece Patio Chaise Lounge Set, Brown","Chaise, Lounge, Set,, Brown, Mfg, #:&nbsp;A2329BRN22, Our, pool, chaise, lounge, chair, set, is, made, with, a, powder-coated, steel, frame., The, back, and, seat, are, made, of, breathable, and, quick-drying, fabric, Textilene, material., Materials, are, durable, and, easy, to, maintain, to, ensure, long-lasting, use, The, backrest, of, this, patio, chaise, lounge, is, slightly, curved, to, provide, better, support, for, the, body.&nbsp;, With, its, 5-position, adjustable, back,, you&#39;re, able, to, change, the, chaise, lounge, into, whichever, position, you&#39;d, like., Moreover,, smooth, armrests, provide, reliable, support,, which, gives, you, more, opportunity, to, enjoy, leisure, time, with, your, friends, and, family., The, back, and, seat, fabric, are, made, of, UV-resistant,, breathable,, Textilene, fabric, for, long-lasting, use., Water, and, oil-proof,, quick-drying,, and, easy, maintenance, Package, includes, all, the, tools, and, hardware, needed, for, assembly, Color:, Brown, Chair, dimensions:, 22&quot;W, x, 62&quot;D, x, 39&quot;H, Fully, reclined:, 22&quot;W, x, 75.7&quot;D, Table, dimensions:, 17.8&quot;W, x, 17.8&quot;D, x, 19&quot;H, Comes, in, 2, boxes, Box, 1, dimensions:, 33.46&quot;L, x, 7.28&quot;W, x, 25.2&quot;H, Box, 2, dimensions:&nbsp;33.46&quot;L, x, 7.28&quot;W, x, 25.2&quot;H, Combined, weight, of, boxes:, 78, lbs&nbsp;",279.99,False
2022-11-21,17:55:34,buy-online,"3-Piece Resin Wicker Bar Set, Beige","Wicker, Bar, Set,, Beige, Mfg, #:&nbsp;AW235-MIX-BGE, Features, a, square, design, Includes, two, square, stools, with, matching, square, bar, Square, stools, can, conveniently, be, put, under, the, bar, for, space-saving, purposes, Comes, with, two, shelves, with, ample, storage, space,, ideal, for, wine, or, other, serving, dishes, Bar, set, doubles, as, a, dining, set, for, two, The, simple, and, classical, design, makes, this, bar, set, the, perfect, piece, of, decor, for, any, indoor, or, outdoor, space, such, as, the, lawn,, poolside,, garden,, or, the, balcony&nbsp;, Outdoor, bar, table, and, stools, have, rubber, feet, protectors&nbsp;, Streamline, edge, is, designed, to, prevent, your, arm, from, scratching, against, the, resin, wicker, surface, Easy, assembly&nbsp;, Overall, dimensions, :, Bar, table:, 39.37&quot;D, x, 22.84&quot;W, x, 39.37&quot;H&nbsp;, Bar, chair:, 14.97&quot;D, x, 14.97&quot;W, x, 28.35&quot;H, Weight, :, 61.73, lbs&nbsp;, Box, dimensions, :, 23.23&quot;L, x, 11.02&quot;W, x, 40.55&quot;H",299.99,False
2022-11-21,17:55:34,buy-online,"3-Piece Soft-Sided Luggage Set with 20"", 24"", & 28"" Suitcases, Black/Gray","Luggage, Set, with, 20&quot;,, 24&quot;,, &amp;, 28&quot;, Suitcases,, Black/Gray, 8-Wheel, Spinner, Expandable, Recessed, Wheels, Whole, Iron, Handle, System, Stretchable, Cross, Strap, Interior, Inside, Zippered, Wet, Pocket, &amp;, Zippered, Mesh, Pocket, 20&quot;, suitcase&nbsp;expands, 1.5&quot;, 24&quot;, suitcase, expands, 1.5&quot;, 28&quot;, suitcase, expands, 2.0&quot;, Color, :&nbsp;Black, Body, with, Gray, Trim, Overall, dimensions, :, Suitcase, 1:, 20&quot;H, x, 13.5&quot;W&nbsp;x, 7.5&quot;D, +, 1.5&quot;, expandable&nbsp;, Suitcase, 2:, 24&quot;H, x, 16&quot;W&nbsp;x, 8.75&quot;D, +, 1.5&quot;, expandable, Suitcase, 3:, 28&quot;H, x, 18&quot;W&nbsp;x, 10&quot;D, +, 2.0&quot;, expandable",180.0,False
2022-11-21,17:55:34,buy-online,"3-Piece Wicker Patio Set, Light Brown","Patio, Set,, Light, Brown, Mfg, #:&nbsp;TJ2211MBR11, Our, outdoor, table, is, designed, for, convenient, storage, The, table, features, a, black, tempered, glass, top, and, a, shelf, below, for, additional, storage., Its, two-layer, design, allows, the, coffee, table, to, hold, more, things, Fully, assembled;, no, assembly, required, Set, contains&nbsp;2, chairs, and, a, rectangular&nbsp;bistro, table, to, place, small, decor, and, beverages,, suitable, for, conversations, with, friends., There, is, also, a, small, shelf, on, the, table, to, store, items,, from, coasters, and, mugs, to, knick-knacks, and, other, decorations, Made, with, a, sturdy, steel, frame, and, wrapped, in, handwoven, PE, rattan., Strong, steel, frame, and, non-slip, feet, support, stability, and, balance, of, chair, Decorative&nbsp;pillows, not, included, Color:, Light, Brown, Table:, 26.4&quot;L, x, 19.7&quot;W, x, 28.3&quot;H, Chair, 1:, 20.1&quot;L, x, 16.5&quot;W, x, 27.2&quot;H, Chair, 2:, 20.1&quot;L, x, 14.2&quot;W, x, 27.2&quot;H, Weight, capacity:, 250, lbs, Please, note:, Chairs, are, of, slightly, different, sizes, for, space-saving, purposes, Assembly, required, &nbsp;, This, item, arrives, in, oversized, packaging, and, may, not, fit, in, smaller, vehicles., Some, customers, may, find, this, item, to, be, too, heavy, to, move, without, assistance, from, a, friend., Please, plan, accordingly, when, coming, to, the, store, to, pick, up, this, item.&nbsp;",249.99,False
